{
  "schemaVersion": "1.0.0",
  "identity": "wo_opifex_312_a3f91c2_a1",
  "branch": "factory/312-a3f91c2-a1",
  "repository": { "owner": "marinoscar", "name": "opifex" },
  "baseCommit": "a3f91c2000000000000000000000000000000000",
  "attempt": 1,
  "issue": {
    "number": 312,
    "url": "https://github.com/marinoscar/opifex/issues/312",
    "title": "Add widget listing"
  },
  "decisionRefs": ["ADR-0002", "ADR-0005"],
  "taskSpec": "Add a paginated GET /api/widgets endpoint behind the existing auth guard.",
  "acceptanceCriteria": [
    "GET /api/widgets returns 200 with a paginated list",
    "A request without a token returns 401",
    "The list is ordered by createdAt descending"
  ],
  "pathConstraints": ["apps/api/src/widgets/**", "apps/api/test/widgets/**"],
  "budgetCeilingUsd": 5,
  "wallClockTimeoutMinutes": 30,
  "needs": ["full-streaming", "cost-reporting"]
}
